No.     Time                          Source                Destination           Protocol Length Info
      1 2025-09-22 13:45:18.331828    e6:c5:01:75:da:82     Broadcast             ARP      42     Who has 10.164.75.190? Tell 10.164.75.150

Frame 1: 42 bytes on wire (336 bits), 42 bytes captured (336 bits) on interface \Device\NPF_{F12C3727-7243-43E8-A737-66239F07376D}, id 0
Ethernet II, Src: e6:c5:01:75:da:82 (e6:c5:01:75:da:82), Dst: Broadcast (ff:ff:ff:ff:ff:ff)
Address Resolution Protocol (request)

No.     Time                          Source                Destination           Protocol Length Info
      2 2025-09-22 13:45:18.348375    2603:1040:a06:3::13   2409:40c2:2041:2b27:3810:1fb5:6364:a871 TLSv1.2  101    Application Data

Frame 2: 101 bytes on wire (808 bits), 101 bytes captured (808 bits) on interface \Device\NPF_{F12C3727-7243-43E8-A737-66239F07376D}, id 0
Ethernet II, Src: e6:c5:01:75:da:82 (e6:c5:01:75:da:82), Dst: 20:cd:84:40:c5:50 (20:cd:84:40:c5:50)
Internet Protocol Version 6, Src: 2603:1040:a06:3::13, Dst: 2409:40c2:2041:2b27:3810:1fb5:6364:a871
Transmission Control Protocol, Src Port: 443, Dst Port: 41930, Seq: 1, Ack: 1, Len: 27
Transport Layer Security

No.     Time                          Source                Destination           Protocol Length Info
      3 2025-09-22 13:45:18.394720    2409:40c2:2041:2b27:3810:1fb5:6364:a871 2603:1040:a06:3::13   TCP      74     41930 → 443 [ACK] Seq=1 Ack=28 Win=252 Len=0

Frame 3: 74 bytes on wire (592 bits), 74 bytes captured (592 bits) on interface \Device\NPF_{F12C3727-7243-43E8-A737-66239F07376D}, id 0
Ethernet II, Src: 20:cd:84:40:c5:50 (20:cd:84:40:c5:50), Dst: e6:c5:01:75:da:82 (e6:c5:01:75:da:82)
Internet Protocol Version 6, Src: 2409:40c2:2041:2b27:3810:1fb5:6364:a871, Dst: 2603:1040:a06:3::13
Transmission Control Protocol, Src Port: 41930, Dst Port: 443, Seq: 1, Ack: 28, Len: 0

No.     Time                          Source                Destination           Protocol Length Info
      4 2025-09-22 13:45:18.418994    2404:6800:4009:805::200a 2409:40c2:2041:2b27:3810:1fb5:6364:a871 UDP      94     443 → 51345 Len=32

Frame 4: 94 bytes on wire (752 bits), 94 bytes captured (752 bits) on interface \Device\NPF_{F12C3727-7243-43E8-A737-66239F07376D}, id 0
Ethernet II, Src: e6:c5:01:75:da:82 (e6:c5:01:75:da:82), Dst: 20:cd:84:40:c5:50 (20:cd:84:40:c5:50)
Internet Protocol Version 6, Src: 2404:6800:4009:805::200a, Dst: 2409:40c2:2041:2b27:3810:1fb5:6364:a871
User Datagram Protocol, Src Port: 443, Dst Port: 51345
Data (32 bytes)

0000  49 98 0a ac 6d 6b 6e ee 86 90 98 bc 68 96 26 61   I...mkn.....h.&a
0010  2a d1 9a 08 5c 92 93 90 24 23 f4 3d 84 cc f2 fe   *...\...$#.=....

No.     Time                          Source                Destination           Protocol Length Info
      5 2025-09-22 13:45:18.441728    2409:40c2:2041:2b27:3810:1fb5:6364:a871 2404:6800:4009:805::200a UDP      102    51345 → 443 Len=40

Frame 5: 102 bytes on wire (816 bits), 102 bytes captured (816 bits) on interface \Device\NPF_{F12C3727-7243-43E8-A737-66239F07376D}, id 0
Ethernet II, Src: 20:cd:84:40:c5:50 (20:cd:84:40:c5:50), Dst: e6:c5:01:75:da:82 (e6:c5:01:75:da:82)
Internet Protocol Version 6, Src: 2409:40c2:2041:2b27:3810:1fb5:6364:a871, Dst: 2404:6800:4009:805::200a
User Datagram Protocol, Src Port: 51345, Dst Port: 443
Data (40 bytes)

0000  49 ef 65 f8 08 e5 bb 72 68 f0 04 63 fc b9 ae 90   I.e....rh..c....
0010  5f 0f 86 03 f1 ec 5b 67 af dc b0 39 c9 ee 4a cd   _.....[g...9..J.
0020  b5 23 ec 83 21 43 b7 90                           .#..!C..

No.     Time                          Source                Destination           Protocol Length Info
      6 2025-09-22 13:45:18.536483    2404:6800:4009:805::200a 2409:40c2:2041:2b27:3810:1fb5:6364:a871 UDP      87     443 → 51345 Len=25

Frame 6: 87 bytes on wire (696 bits), 87 bytes captured (696 bits) on interface \Device\NPF_{F12C3727-7243-43E8-A737-66239F07376D}, id 0
Ethernet II, Src: e6:c5:01:75:da:82 (e6:c5:01:75:da:82), Dst: 20:cd:84:40:c5:50 (20:cd:84:40:c5:50)
Internet Protocol Version 6, Src: 2404:6800:4009:805::200a, Dst: 2409:40c2:2041:2b27:3810:1fb5:6364:a871
User Datagram Protocol, Src Port: 443, Dst Port: 51345
Data (25 bytes)

0000  5b 34 53 95 90 8e 2d 60 f5 0a 5d a1 6a c7 5e a0   [4S...-`..].j.^.
0010  91 e3 29 ff b5 a8 0b ed f1                        ..)......

No.     Time                          Source                Destination           Protocol Length Info
      7 2025-09-22 13:45:19.419899    2409:40c2:2041:2b27:3810:1fb5:6364:a871 2603:1040:a06:3::13   TLSv1.2  102    Application Data

Frame 7: 102 bytes on wire (816 bits), 102 bytes captured (816 bits) on interface \Device\NPF_{F12C3727-7243-43E8-A737-66239F07376D}, id 0
Ethernet II, Src: 20:cd:84:40:c5:50 (20:cd:84:40:c5:50), Dst: e6:c5:01:75:da:82 (e6:c5:01:75:da:82)
Internet Protocol Version 6, Src: 2409:40c2:2041:2b27:3810:1fb5:6364:a871, Dst: 2603:1040:a06:3::13
Transmission Control Protocol, Src Port: 41930, Dst Port: 443, Seq: 1, Ack: 28, Len: 28
Transport Layer Security

No.     Time                          Source                Destination           Protocol Length Info
      8 2025-09-22 13:45:19.508401    2603:1040:a06:3::13   2409:40c2:2041:2b27:3810:1fb5:6364:a871 TCP      74     443 → 41930 [ACK] Seq=28 Ack=29 Win=643 Len=0

Frame 8: 74 bytes on wire (592 bits), 74 bytes captured (592 bits) on interface \Device\NPF_{F12C3727-7243-43E8-A737-66239F07376D}, id 0
Ethernet II, Src: e6:c5:01:75:da:82 (e6:c5:01:75:da:82), Dst: 20:cd:84:40:c5:50 (20:cd:84:40:c5:50)
Internet Protocol Version 6, Src: 2603:1040:a06:3::13, Dst: 2409:40c2:2041:2b27:3810:1fb5:6364:a871
Transmission Control Protocol, Src Port: 443, Dst Port: 41930, Seq: 28, Ack: 29, Len: 0

No.     Time                          Source                Destination           Protocol Length Info
      9 2025-09-22 13:45:19.964267    10.164.75.198         10.164.75.150         DNS      75     Standard query 0x775c AAAA ssl.gstatic.com

Frame 9: 75 bytes on wire (600 bits), 75 bytes captured (600 bits) on interface \Device\NPF_{F12C3727-7243-43E8-A737-66239F07376D}, id 0
Ethernet II, Src: 20:cd:84:40:c5:50 (20:cd:84:40:c5:50), Dst: e6:c5:01:75:da:82 (e6:c5:01:75:da:82)
Internet Protocol Version 4, Src: 10.164.75.198, Dst: 10.164.75.150
User Datagram Protocol, Src Port: 51830, Dst Port: 53
Domain Name System (query)

No.     Time                          Source                Destination           Protocol Length Info
     10 2025-09-22 13:45:19.964387    10.164.75.198         10.164.75.150         DNS      75     Standard query 0x5be6 A ssl.gstatic.com

Frame 10: 75 bytes on wire (600 bits), 75 bytes captured (600 bits) on interface \Device\NPF_{F12C3727-7243-43E8-A737-66239F07376D}, id 0
Ethernet II, Src: 20:cd:84:40:c5:50 (20:cd:84:40:c5:50), Dst: e6:c5:01:75:da:82 (e6:c5:01:75:da:82)
Internet Protocol Version 4, Src: 10.164.75.198, Dst: 10.164.75.150
User Datagram Protocol, Src Port: 61237, Dst Port: 53
Domain Name System (query)

No.     Time                          Source                Destination           Protocol Length Info
     11 2025-09-22 13:45:19.964447    10.164.75.198         10.164.75.150         DNS      75     Standard query 0x1b39 HTTPS ssl.gstatic.com

Frame 11: 75 bytes on wire (600 bits), 75 bytes captured (600 bits) on interface \Device\NPF_{F12C3727-7243-43E8-A737-66239F07376D}, id 0
Ethernet II, Src: 20:cd:84:40:c5:50 (20:cd:84:40:c5:50), Dst: e6:c5:01:75:da:82 (e6:c5:01:75:da:82)
Internet Protocol Version 4, Src: 10.164.75.198, Dst: 10.164.75.150
User Datagram Protocol, Src Port: 61537, Dst Port: 53
Domain Name System (query)

No.     Time                          Source                Destination           Protocol Length Info
     12 2025-09-22 13:45:19.967574    10.164.75.150         10.164.75.198         DNS      103    Standard query response 0x775c AAAA ssl.gstatic.com AAAA 2404:6800:4009:806::2003

Frame 12: 103 bytes on wire (824 bits), 103 bytes captured (824 bits) on interface \Device\NPF_{F12C3727-7243-43E8-A737-66239F07376D}, id 0
Ethernet II, Src: e6:c5:01:75:da:82 (e6:c5:01:75:da:82), Dst: 20:cd:84:40:c5:50 (20:cd:84:40:c5:50)
Internet Protocol Version 4, Src: 10.164.75.150, Dst: 10.164.75.198
User Datagram Protocol, Src Port: 53, Dst Port: 51830
Domain Name System (response)

No.     Time                          Source                Destination           Protocol Length Info
     13 2025-09-22 13:45:19.969946    10.164.75.150         10.164.75.198         DNS      91     Standard query response 0x5be6 A ssl.gstatic.com A 142.250.182.99

Frame 13: 91 bytes on wire (728 bits), 91 bytes captured (728 bits) on interface \Device\NPF_{F12C3727-7243-43E8-A737-66239F07376D}, id 0
Ethernet II, Src: e6:c5:01:75:da:82 (e6:c5:01:75:da:82), Dst: 20:cd:84:40:c5:50 (20:cd:84:40:c5:50)
Internet Protocol Version 4, Src: 10.164.75.150, Dst: 10.164.75.198
User Datagram Protocol, Src Port: 53, Dst Port: 61237
Domain Name System (response)

No.     Time                          Source                Destination           Protocol Length Info
     14 2025-09-22 13:45:19.984921    2409:40c2:2041:2b27:3810:1fb5:6364:a871 2404:6800:4009:806::2003 QUIC     1292   Initial, DCID=4470e3e82a62a0af, PKN: 1, PADDING, CRYPTO, PADDING, CRYPTO, PADDING, CRYPTO, CRYPTO, CRYPTO, CRYPTO, PADDING, CRYPTO, CRYPTO, PADDING, PING, PING, CRYPTO, CRYPTO

Frame 14: 1292 bytes on wire (10336 bits), 1292 bytes captured (10336 bits) on interface \Device\NPF_{F12C3727-7243-43E8-A737-66239F07376D}, id 0
Ethernet II, Src: 20:cd:84:40:c5:50 (20:cd:84:40:c5:50), Dst: e6:c5:01:75:da:82 (e6:c5:01:75:da:82)
Internet Protocol Version 6, Src: 2409:40c2:2041:2b27:3810:1fb5:6364:a871, Dst: 2404:6800:4009:806::2003
User Datagram Protocol, Src Port: 64072, Dst Port: 443
QUIC IETF

No.     Time                          Source                Destination           Protocol Length Info
     15 2025-09-22 13:45:19.985010    2409:40c2:2041:2b27:3810:1fb5:6364:a871 2404:6800:4009:806::2003 QUIC     1292   Initial, DCID=4470e3e82a62a0af, PKN: 2, CRYPTO

Frame 15: 1292 bytes on wire (10336 bits), 1292 bytes captured (10336 bits) on interface \Device\NPF_{F12C3727-7243-43E8-A737-66239F07376D}, id 0
Ethernet II, Src: 20:cd:84:40:c5:50 (20:cd:84:40:c5:50), Dst: e6:c5:01:75:da:82 (e6:c5:01:75:da:82)
Internet Protocol Version 6, Src: 2409:40c2:2041:2b27:3810:1fb5:6364:a871, Dst: 2404:6800:4009:806::2003
User Datagram Protocol, Src Port: 64072, Dst Port: 443
QUIC IETF

No.     Time                          Source                Destination           Protocol Length Info
     16 2025-09-22 13:45:19.985042    2409:40c2:2041:2b27:3810:1fb5:6364:a871 2404:6800:4009:806::2003 QUIC     1292   Initial, DCID=4470e3e82a62a0af, PKN: 3, CRYPTO, PING, PADDING, CRYPTO, CRYPTO, CRYPTO, CRYPTO, CRYPTO, CRYPTO, PADDING, CRYPTO, PADDING, PING, PING, PING, CRYPTO, PADDING

Frame 16: 1292 bytes on wire (10336 bits), 1292 bytes captured (10336 bits) on interface \Device\NPF_{F12C3727-7243-43E8-A737-66239F07376D}, id 0
Ethernet II, Src: 20:cd:84:40:c5:50 (20:cd:84:40:c5:50), Dst: e6:c5:01:75:da:82 (e6:c5:01:75:da:82)
Internet Protocol Version 6, Src: 2409:40c2:2041:2b27:3810:1fb5:6364:a871, Dst: 2404:6800:4009:806::2003
User Datagram Protocol, Src Port: 64072, Dst Port: 443
QUIC IETF

No.     Time                          Source                Destination           Protocol Length Info
     17 2025-09-22 13:45:19.985338    2409:40c2:2041:2b27:3810:1fb5:6364:a871 2404:6800:4009:806::2003 QUIC     142    0-RTT, DCID=4470e3e82a62a0af

Frame 17: 142 bytes on wire (1136 bits), 142 bytes captured (1136 bits) on interface \Device\NPF_{F12C3727-7243-43E8-A737-66239F07376D}, id 0
Ethernet II, Src: 20:cd:84:40:c5:50 (20:cd:84:40:c5:50), Dst: e6:c5:01:75:da:82 (e6:c5:01:75:da:82)
Internet Protocol Version 6, Src: 2409:40c2:2041:2b27:3810:1fb5:6364:a871, Dst: 2404:6800:4009:806::2003
User Datagram Protocol, Src Port: 64072, Dst Port: 443
QUIC IETF

No.     Time                          Source                Destination           Protocol Length Info
     18 2025-09-22 13:45:19.985622    2409:40c2:2041:2b27:3810:1fb5:6364:a871 2404:6800:4009:806::2003 QUIC     755    0-RTT, DCID=4470e3e82a62a0af

Frame 18: 755 bytes on wire (6040 bits), 755 bytes captured (6040 bits) on interface \Device\NPF_{F12C3727-7243-43E8-A737-66239F07376D}, id 0
Ethernet II, Src: 20:cd:84:40:c5:50 (20:cd:84:40:c5:50), Dst: e6:c5:01:75:da:82 (e6:c5:01:75:da:82)
Internet Protocol Version 6, Src: 2409:40c2:2041:2b27:3810:1fb5:6364:a871, Dst: 2404:6800:4009:806::2003
User Datagram Protocol, Src Port: 64072, Dst Port: 443
QUIC IETF

No.     Time                          Source                Destination           Protocol Length Info
     19 2025-09-22 13:45:20.021259    10.164.75.150         10.164.75.198         DNS      132    Standard query response 0x1b39 HTTPS ssl.gstatic.com SOA ns1.google.com

Frame 19: 132 bytes on wire (1056 bits), 132 bytes captured (1056 bits) on interface \Device\NPF_{F12C3727-7243-43E8-A737-66239F07376D}, id 0
Ethernet II, Src: e6:c5:01:75:da:82 (e6:c5:01:75:da:82), Dst: 20:cd:84:40:c5:50 (20:cd:84:40:c5:50)
Internet Protocol Version 4, Src: 10.164.75.150, Dst: 10.164.75.198
User Datagram Protocol, Src Port: 53, Dst Port: 61537
Domain Name System (response)

No.     Time                          Source                Destination           Protocol Length Info
     20 2025-09-22 13:45:20.021329    10.164.75.198         10.164.75.150         ICMP     160    Destination unreachable (Port unreachable)

Frame 20: 160 bytes on wire (1280 bits), 160 bytes captured (1280 bits) on interface \Device\NPF_{F12C3727-7243-43E8-A737-66239F07376D}, id 0
Ethernet II, Src: 20:cd:84:40:c5:50 (20:cd:84:40:c5:50), Dst: e6:c5:01:75:da:82 (e6:c5:01:75:da:82)
Internet Protocol Version 4, Src: 10.164.75.198, Dst: 10.164.75.150
Internet Control Message Protocol

No.     Time                          Source                Destination           Protocol Length Info
     21 2025-09-22 13:45:20.084907    2404:6800:4009:806::2003 2409:40c2:2041:2b27:3810:1fb5:6364:a871 QUIC     102    Initial, SCID=e470e3e82a62a0af, PKN: 1, ACK

Frame 21: 102 bytes on wire (816 bits), 102 bytes captured (816 bits) on interface \Device\NPF_{F12C3727-7243-43E8-A737-66239F07376D}, id 0
Ethernet II, Src: e6:c5:01:75:da:82 (e6:c5:01:75:da:82), Dst: 20:cd:84:40:c5:50 (20:cd:84:40:c5:50)
Internet Protocol Version 6, Src: 2404:6800:4009:806::2003, Dst: 2409:40c2:2041:2b27:3810:1fb5:6364:a871
User Datagram Protocol, Src Port: 443, Dst Port: 64072
QUIC IETF

No.     Time                          Source                Destination           Protocol Length Info
     22 2025-09-22 13:45:20.096893    2404:6800:4009:806::2003 2409:40c2:2041:2b27:3810:1fb5:6364:a871 QUIC     102    Initial, SCID=e470e3e82a62a0af, PKN: 2, ACK

Frame 22: 102 bytes on wire (816 bits), 102 bytes captured (816 bits) on interface \Device\NPF_{F12C3727-7243-43E8-A737-66239F07376D}, id 0
Ethernet II, Src: e6:c5:01:75:da:82 (e6:c5:01:75:da:82), Dst: 20:cd:84:40:c5:50 (20:cd:84:40:c5:50)
Internet Protocol Version 6, Src: 2404:6800:4009:806::2003, Dst: 2409:40c2:2041:2b27:3810:1fb5:6364:a871
User Datagram Protocol, Src Port: 443, Dst Port: 64072
QUIC IETF

No.     Time                          Source                Destination           Protocol Length Info
     23 2025-09-22 13:45:20.097394    2404:6800:4009:806::2003 2409:40c2:2041:2b27:3810:1fb5:6364:a871 QUIC     1292   Initial, SCID=e470e3e82a62a0af, PKN: 3, ACK, PADDING

Frame 23: 1292 bytes on wire (10336 bits), 1292 bytes captured (10336 bits) on interface \Device\NPF_{F12C3727-7243-43E8-A737-66239F07376D}, id 0
Ethernet II, Src: e6:c5:01:75:da:82 (e6:c5:01:75:da:82), Dst: 20:cd:84:40:c5:50 (20:cd:84:40:c5:50)
Internet Protocol Version 6, Src: 2404:6800:4009:806::2003, Dst: 2409:40c2:2041:2b27:3810:1fb5:6364:a871
User Datagram Protocol, Src Port: 443, Dst Port: 64072
QUIC IETF

No.     Time                          Source                Destination           Protocol Length Info
     24 2025-09-22 13:45:20.097780    2404:6800:4009:806::2003 2409:40c2:2041:2b27:3810:1fb5:6364:a871 QUIC     1292   Initial, SCID=e470e3e82a62a0af, PKN: 4, ACK, PADDING

Frame 24: 1292 bytes on wire (10336 bits), 1292 bytes captured (10336 bits) on interface \Device\NPF_{F12C3727-7243-43E8-A737-66239F07376D}, id 0
Ethernet II, Src: e6:c5:01:75:da:82 (e6:c5:01:75:da:82), Dst: 20:cd:84:40:c5:50 (20:cd:84:40:c5:50)
Internet Protocol Version 6, Src: 2404:6800:4009:806::2003, Dst: 2409:40c2:2041:2b27:3810:1fb5:6364:a871
User Datagram Protocol, Src Port: 443, Dst Port: 64072
QUIC IETF

No.     Time                          Source                Destination           Protocol Length Info
     25 2025-09-22 13:45:20.158513    2404:6800:4009:806::2003 2409:40c2:2041:2b27:3810:1fb5:6364:a871 QUIC     1292   Initial, SCID=e470e3e82a62a0af, PKN: 5, CRYPTO, PADDING

Frame 25: 1292 bytes on wire (10336 bits), 1292 bytes captured (10336 bits) on interface \Device\NPF_{F12C3727-7243-43E8-A737-66239F07376D}, id 0
Ethernet II, Src: e6:c5:01:75:da:82 (e6:c5:01:75:da:82), Dst: 20:cd:84:40:c5:50 (20:cd:84:40:c5:50)
Internet Protocol Version 6, Src: 2404:6800:4009:806::2003, Dst: 2409:40c2:2041:2b27:3810:1fb5:6364:a871
User Datagram Protocol, Src Port: 443, Dst Port: 64072
QUIC IETF

No.     Time                          Source                Destination           Protocol Length Info
     26 2025-09-22 13:45:20.158513    2404:6800:4009:806::2003 2409:40c2:2041:2b27:3810:1fb5:6364:a871 QUIC     362    Protected Payload (KP0)

Frame 26: 362 bytes on wire (2896 bits), 362 bytes captured (2896 bits) on interface \Device\NPF_{F12C3727-7243-43E8-A737-66239F07376D}, id 0
Ethernet II, Src: e6:c5:01:75:da:82 (e6:c5:01:75:da:82), Dst: 20:cd:84:40:c5:50 (20:cd:84:40:c5:50)
Internet Protocol Version 6, Src: 2404:6800:4009:806::2003, Dst: 2409:40c2:2041:2b27:3810:1fb5:6364:a871
User Datagram Protocol, Src Port: 443, Dst Port: 64072
QUIC IETF
QUIC IETF

No.     Time                          Source                Destination           Protocol Length Info
     27 2025-09-22 13:45:20.158513    2404:6800:4009:806::2003 2409:40c2:2041:2b27:3810:1fb5:6364:a871 QUIC     992    Protected Payload (KP0)

Frame 27: 992 bytes on wire (7936 bits), 992 bytes captured (7936 bits) on interface \Device\NPF_{F12C3727-7243-43E8-A737-66239F07376D}, id 0
Ethernet II, Src: e6:c5:01:75:da:82 (e6:c5:01:75:da:82), Dst: 20:cd:84:40:c5:50 (20:cd:84:40:c5:50)
Internet Protocol Version 6, Src: 2404:6800:4009:806::2003, Dst: 2409:40c2:2041:2b27:3810:1fb5:6364:a871
User Datagram Protocol, Src Port: 443, Dst Port: 64072
QUIC IETF

No.     Time                          Source                Destination           Protocol Length Info
     28 2025-09-22 13:45:20.158513    2404:6800:4009:806::2003 2409:40c2:2041:2b27:3810:1fb5:6364:a871 QUIC     99     Protected Payload (KP0)

Frame 28: 99 bytes on wire (792 bits), 99 bytes captured (792 bits) on interface \Device\NPF_{F12C3727-7243-43E8-A737-66239F07376D}, id 0
Ethernet II, Src: e6:c5:01:75:da:82 (e6:c5:01:75:da:82), Dst: 20:cd:84:40:c5:50 (20:cd:84:40:c5:50)
Internet Protocol Version 6, Src: 2404:6800:4009:806::2003, Dst: 2409:40c2:2041:2b27:3810:1fb5:6364:a871
User Datagram Protocol, Src Port: 443, Dst Port: 64072
QUIC IETF

No.     Time                          Source                Destination           Protocol Length Info
     29 2025-09-22 13:45:20.158513    2404:6800:4009:806::2003 2409:40c2:2041:2b27:3810:1fb5:6364:a871 QUIC     86     Protected Payload (KP0)

Frame 29: 86 bytes on wire (688 bits), 86 bytes captured (688 bits) on interface \Device\NPF_{F12C3727-7243-43E8-A737-66239F07376D}, id 0
Ethernet II, Src: e6:c5:01:75:da:82 (e6:c5:01:75:da:82), Dst: 20:cd:84:40:c5:50 (20:cd:84:40:c5:50)
Internet Protocol Version 6, Src: 2404:6800:4009:806::2003, Dst: 2409:40c2:2041:2b27:3810:1fb5:6364:a871
User Datagram Protocol, Src Port: 443, Dst Port: 64072
QUIC IETF

No.     Time                          Source                Destination           Protocol Length Info
     30 2025-09-22 13:45:20.159960    2409:40c2:2041:2b27:3810:1fb5:6364:a871 2404:6800:4009:806::2003 QUIC     140    Handshake, DCID=e470e3e82a62a0af

Frame 30: 140 bytes on wire (1120 bits), 140 bytes captured (1120 bits) on interface \Device\NPF_{F12C3727-7243-43E8-A737-66239F07376D}, id 0
Ethernet II, Src: 20:cd:84:40:c5:50 (20:cd:84:40:c5:50), Dst: e6:c5:01:75:da:82 (e6:c5:01:75:da:82)
Internet Protocol Version 6, Src: 2409:40c2:2041:2b27:3810:1fb5:6364:a871, Dst: 2404:6800:4009:806::2003
User Datagram Protocol, Src Port: 64072, Dst Port: 443
QUIC IETF

No.     Time                          Source                Destination           Protocol Length Info
     31 2025-09-22 13:45:20.160347    2409:40c2:2041:2b27:3810:1fb5:6364:a871 2404:6800:4009:806::2003 QUIC     93     Protected Payload (KP0), DCID=e470e3e82a62a0af

Frame 31: 93 bytes on wire (744 bits), 93 bytes captured (744 bits) on interface \Device\NPF_{F12C3727-7243-43E8-A737-66239F07376D}, id 0
Ethernet II, Src: 20:cd:84:40:c5:50 (20:cd:84:40:c5:50), Dst: e6:c5:01:75:da:82 (e6:c5:01:75:da:82)
Internet Protocol Version 6, Src: 2409:40c2:2041:2b27:3810:1fb5:6364:a871, Dst: 2404:6800:4009:806::2003
User Datagram Protocol, Src Port: 64072, Dst Port: 443
QUIC IETF

No.     Time                          Source                Destination           Protocol Length Info
     32 2025-09-22 13:45:20.160589    2404:6800:4009:806::2003 2409:40c2:2041:2b27:3810:1fb5:6364:a871 QUIC     84     Protected Payload (KP0)

Frame 32: 84 bytes on wire (672 bits), 84 bytes captured (672 bits) on interface \Device\NPF_{F12C3727-7243-43E8-A737-66239F07376D}, id 0
Ethernet II, Src: e6:c5:01:75:da:82 (e6:c5:01:75:da:82), Dst: 20:cd:84:40:c5:50 (20:cd:84:40:c5:50)
Internet Protocol Version 6, Src: 2404:6800:4009:806::2003, Dst: 2409:40c2:2041:2b27:3810:1fb5:6364:a871
User Datagram Protocol, Src Port: 443, Dst Port: 64072
QUIC IETF

No.     Time                          Source                Destination           Protocol Length Info
     33 2025-09-22 13:45:20.160990    2409:40c2:2041:2b27:3810:1fb5:6364:a871 2404:6800:4009:806::2003 QUIC     93     Protected Payload (KP0), DCID=e470e3e82a62a0af

Frame 33: 93 bytes on wire (744 bits), 93 bytes captured (744 bits) on interface \Device\NPF_{F12C3727-7243-43E8-A737-66239F07376D}, id 0
Ethernet II, Src: 20:cd:84:40:c5:50 (20:cd:84:40:c5:50), Dst: e6:c5:01:75:da:82 (e6:c5:01:75:da:82)
Internet Protocol Version 6, Src: 2409:40c2:2041:2b27:3810:1fb5:6364:a871, Dst: 2404:6800:4009:806::2003
User Datagram Protocol, Src Port: 64072, Dst Port: 443
QUIC IETF

No.     Time                          Source                Destination           Protocol Length Info
     34 2025-09-22 13:45:20.223853    2404:6800:4009:806::2003 2409:40c2:2041:2b27:3810:1fb5:6364:a871 QUIC     590    Protected Payload (KP0)

Frame 34: 590 bytes on wire (4720 bits), 590 bytes captured (4720 bits) on interface \Device\NPF_{F12C3727-7243-43E8-A737-66239F07376D}, id 0
Ethernet II, Src: e6:c5:01:75:da:82 (e6:c5:01:75:da:82), Dst: 20:cd:84:40:c5:50 (20:cd:84:40:c5:50)
Internet Protocol Version 6, Src: 2404:6800:4009:806::2003, Dst: 2409:40c2:2041:2b27:3810:1fb5:6364:a871
User Datagram Protocol, Src Port: 443, Dst Port: 64072
QUIC IETF

No.     Time                          Source                Destination           Protocol Length Info
     35 2025-09-22 13:45:20.223853    2404:6800:4009:806::2003 2409:40c2:2041:2b27:3810:1fb5:6364:a871 QUIC     85     Protected Payload (KP0)

Frame 35: 85 bytes on wire (680 bits), 85 bytes captured (680 bits) on interface \Device\NPF_{F12C3727-7243-43E8-A737-66239F07376D}, id 0
Ethernet II, Src: e6:c5:01:75:da:82 (e6:c5:01:75:da:82), Dst: 20:cd:84:40:c5:50 (20:cd:84:40:c5:50)
Internet Protocol Version 6, Src: 2404:6800:4009:806::2003, Dst: 2409:40c2:2041:2b27:3810:1fb5:6364:a871
User Datagram Protocol, Src Port: 443, Dst Port: 64072
QUIC IETF

No.     Time                          Source                Destination           Protocol Length Info
     36 2025-09-22 13:45:20.224600    2409:40c2:2041:2b27:3810:1fb5:6364:a871 2404:6800:4009:806::2003 QUIC     97     Protected Payload (KP0), DCID=e470e3e82a62a0af

Frame 36: 97 bytes on wire (776 bits), 97 bytes captured (776 bits) on interface \Device\NPF_{F12C3727-7243-43E8-A737-66239F07376D}, id 0
Ethernet II, Src: 20:cd:84:40:c5:50 (20:cd:84:40:c5:50), Dst: e6:c5:01:75:da:82 (e6:c5:01:75:da:82)
Internet Protocol Version 6, Src: 2409:40c2:2041:2b27:3810:1fb5:6364:a871, Dst: 2404:6800:4009:806::2003
User Datagram Protocol, Src Port: 64072, Dst Port: 443
QUIC IETF

No.     Time                          Source                Destination           Protocol Length Info
     37 2025-09-22 13:45:20.238791    2404:6800:4009:806::2003 2409:40c2:2041:2b27:3810:1fb5:6364:a871 QUIC     182    Protected Payload (KP0)

Frame 37: 182 bytes on wire (1456 bits), 182 bytes captured (1456 bits) on interface \Device\NPF_{F12C3727-7243-43E8-A737-66239F07376D}, id 0
Ethernet II, Src: e6:c5:01:75:da:82 (e6:c5:01:75:da:82), Dst: 20:cd:84:40:c5:50 (20:cd:84:40:c5:50)
Internet Protocol Version 6, Src: 2404:6800:4009:806::2003, Dst: 2409:40c2:2041:2b27:3810:1fb5:6364:a871
User Datagram Protocol, Src Port: 443, Dst Port: 64072
QUIC IETF

No.     Time                          Source                Destination           Protocol Length Info
     38 2025-09-22 13:45:20.279114    2409:40c2:2041:2b27:3810:1fb5:6364:a871 2404:6800:4009:806::2003 QUIC     94     Protected Payload (KP0), DCID=e470e3e82a62a0af

Frame 38: 94 bytes on wire (752 bits), 94 bytes captured (752 bits) on interface \Device\NPF_{F12C3727-7243-43E8-A737-66239F07376D}, id 0
Ethernet II, Src: 20:cd:84:40:c5:50 (20:cd:84:40:c5:50), Dst: e6:c5:01:75:da:82 (e6:c5:01:75:da:82)
Internet Protocol Version 6, Src: 2409:40c2:2041:2b27:3810:1fb5:6364:a871, Dst: 2404:6800:4009:806::2003
User Datagram Protocol, Src Port: 64072, Dst Port: 443
QUIC IETF

No.     Time                          Source                Destination           Protocol Length Info
     39 2025-09-22 13:45:20.304015    2404:6800:4009:806::2003 2409:40c2:2041:2b27:3810:1fb5:6364:a871 QUIC     85     Protected Payload (KP0)

Frame 39: 85 bytes on wire (680 bits), 85 bytes captured (680 bits) on interface \Device\NPF_{F12C3727-7243-43E8-A737-66239F07376D}, id 0
Ethernet II, Src: e6:c5:01:75:da:82 (e6:c5:01:75:da:82), Dst: 20:cd:84:40:c5:50 (20:cd:84:40:c5:50)
Internet Protocol Version 6, Src: 2404:6800:4009:806::2003, Dst: 2409:40c2:2041:2b27:3810:1fb5:6364:a871
User Datagram Protocol, Src Port: 443, Dst Port: 64072
QUIC IETF

No.     Time                          Source                Destination           Protocol Length Info
     40 2025-09-22 13:45:20.704174    10.164.75.198         10.164.75.150         DNS      75     Standard query 0x6846 AAAA docs.google.com

Frame 40: 75 bytes on wire (600 bits), 75 bytes captured (600 bits) on interface \Device\NPF_{F12C3727-7243-43E8-A737-66239F07376D}, id 0
Ethernet II, Src: 20:cd:84:40:c5:50 (20:cd:84:40:c5:50), Dst: e6:c5:01:75:da:82 (e6:c5:01:75:da:82)
Internet Protocol Version 4, Src: 10.164.75.198, Dst: 10.164.75.150
User Datagram Protocol, Src Port: 65411, Dst Port: 53
Domain Name System (query)

No.     Time                          Source                Destination           Protocol Length Info
     41 2025-09-22 13:45:20.704372    10.164.75.198         10.164.75.150         DNS      75     Standard query 0x09e3 A docs.google.com

Frame 41: 75 bytes on wire (600 bits), 75 bytes captured (600 bits) on interface \Device\NPF_{F12C3727-7243-43E8-A737-66239F07376D}, id 0
Ethernet II, Src: 20:cd:84:40:c5:50 (20:cd:84:40:c5:50), Dst: e6:c5:01:75:da:82 (e6:c5:01:75:da:82)
Internet Protocol Version 4, Src: 10.164.75.198, Dst: 10.164.75.150
User Datagram Protocol, Src Port: 55976, Dst Port: 53
Domain Name System (query)

No.     Time                          Source                Destination           Protocol Length Info
     42 2025-09-22 13:45:20.704465    10.164.75.198         10.164.75.150         DNS      75     Standard query 0x2759 HTTPS docs.google.com

Frame 42: 75 bytes on wire (600 bits), 75 bytes captured (600 bits) on interface \Device\NPF_{F12C3727-7243-43E8-A737-66239F07376D}, id 0
Ethernet II, Src: 20:cd:84:40:c5:50 (20:cd:84:40:c5:50), Dst: e6:c5:01:75:da:82 (e6:c5:01:75:da:82)
Internet Protocol Version 4, Src: 10.164.75.198, Dst: 10.164.75.150
User Datagram Protocol, Src Port: 57275, Dst Port: 53
Domain Name System (query)

No.     Time                          Source                Destination           Protocol Length Info
     43 2025-09-22 13:45:20.707881    10.164.75.150         10.164.75.198         DNS      103    Standard query response 0x6846 AAAA docs.google.com AAAA 2404:6800:4009:80f::200e

Frame 43: 103 bytes on wire (824 bits), 103 bytes captured (824 bits) on interface \Device\NPF_{F12C3727-7243-43E8-A737-66239F07376D}, id 0
Ethernet II, Src: e6:c5:01:75:da:82 (e6:c5:01:75:da:82), Dst: 20:cd:84:40:c5:50 (20:cd:84:40:c5:50)
Internet Protocol Version 4, Src: 10.164.75.150, Dst: 10.164.75.198
User Datagram Protocol, Src Port: 53, Dst Port: 65411
Domain Name System (response)

No.     Time                          Source                Destination           Protocol Length Info
     44 2025-09-22 13:45:20.741925    10.164.75.150         10.164.75.198         DNS      91     Standard query response 0x09e3 A docs.google.com A 172.217.167.206

Frame 44: 91 bytes on wire (728 bits), 91 bytes captured (728 bits) on interface \Device\NPF_{F12C3727-7243-43E8-A737-66239F07376D}, id 0
Ethernet II, Src: e6:c5:01:75:da:82 (e6:c5:01:75:da:82), Dst: 20:cd:84:40:c5:50 (20:cd:84:40:c5:50)
Internet Protocol Version 4, Src: 10.164.75.150, Dst: 10.164.75.198
User Datagram Protocol, Src Port: 53, Dst Port: 55976
Domain Name System (response)

No.     Time                          Source                Destination           Protocol Length Info
     45 2025-09-22 13:45:20.741925    10.164.75.150         10.164.75.198         DNS      125    Standard query response 0x2759 HTTPS docs.google.com SOA ns1.google.com

Frame 45: 125 bytes on wire (1000 bits), 125 bytes captured (1000 bits) on interface \Device\NPF_{F12C3727-7243-43E8-A737-66239F07376D}, id 0
Ethernet II, Src: e6:c5:01:75:da:82 (e6:c5:01:75:da:82), Dst: 20:cd:84:40:c5:50 (20:cd:84:40:c5:50)
Internet Protocol Version 4, Src: 10.164.75.150, Dst: 10.164.75.198
User Datagram Protocol, Src Port: 53, Dst Port: 57275
Domain Name System (response)

No.     Time                          Source                Destination           Protocol Length Info
     46 2025-09-22 13:45:20.744178    2409:40c2:2041:2b27:3810:1fb5:6364:a871 2404:6800:4009:80f::200e QUIC     1292   Initial, DCID=f16279e079c1d051, PKN: 1, CRYPTO, PADDING, PING, CRYPTO, CRYPTO, PING, PADDING, PING, PADDING, PING, PING, PADDING, CRYPTO, PING, PADDING, CRYPTO

Frame 46: 1292 bytes on wire (10336 bits), 1292 bytes captured (10336 bits) on interface \Device\NPF_{F12C3727-7243-43E8-A737-66239F07376D}, id 0
Ethernet II, Src: 20:cd:84:40:c5:50 (20:cd:84:40:c5:50), Dst: e6:c5:01:75:da:82 (e6:c5:01:75:da:82)
Internet Protocol Version 6, Src: 2409:40c2:2041:2b27:3810:1fb5:6364:a871, Dst: 2404:6800:4009:80f::200e
User Datagram Protocol, Src Port: 56960, Dst Port: 443
QUIC IETF

No.     Time                          Source                Destination           Protocol Length Info
     47 2025-09-22 13:45:20.744266    2409:40c2:2041:2b27:3810:1fb5:6364:a871 2404:6800:4009:80f::200e QUIC     1292   Initial, DCID=f16279e079c1d051, PKN: 2, CRYPTO

Frame 47: 1292 bytes on wire (10336 bits), 1292 bytes captured (10336 bits) on interface \Device\NPF_{F12C3727-7243-43E8-A737-66239F07376D}, id 0
Ethernet II, Src: 20:cd:84:40:c5:50 (20:cd:84:40:c5:50), Dst: e6:c5:01:75:da:82 (e6:c5:01:75:da:82)
Internet Protocol Version 6, Src: 2409:40c2:2041:2b27:3810:1fb5:6364:a871, Dst: 2404:6800:4009:80f::200e
User Datagram Protocol, Src Port: 56960, Dst Port: 443
QUIC IETF

No.     Time                          Source                Destination           Protocol Length Info
     48 2025-09-22 13:45:20.744299    2409:40c2:2041:2b27:3810:1fb5:6364:a871 2404:6800:4009:80f::200e QUIC     1292   Initial, DCID=f16279e079c1d051, PKN: 3, PING, PADDING, PING, PING, PADDING, PING, CRYPTO, PADDING, CRYPTO, CRYPTO, CRYPTO, CRYPTO

Frame 48: 1292 bytes on wire (10336 bits), 1292 bytes captured (10336 bits) on interface \Device\NPF_{F12C3727-7243-43E8-A737-66239F07376D}, id 0
Ethernet II, Src: 20:cd:84:40:c5:50 (20:cd:84:40:c5:50), Dst: e6:c5:01:75:da:82 (e6:c5:01:75:da:82)
Internet Protocol Version 6, Src: 2409:40c2:2041:2b27:3810:1fb5:6364:a871, Dst: 2404:6800:4009:80f::200e
User Datagram Protocol, Src Port: 56960, Dst Port: 443
QUIC IETF

No.     Time                          Source                Destination           Protocol Length Info
     49 2025-09-22 13:45:20.744564    2409:40c2:2041:2b27:3810:1fb5:6364:a871 2404:6800:4009:80f::200e QUIC     144    0-RTT, DCID=f16279e079c1d051

Frame 49: 144 bytes on wire (1152 bits), 144 bytes captured (1152 bits) on interface \Device\NPF_{F12C3727-7243-43E8-A737-66239F07376D}, id 0
Ethernet II, Src: 20:cd:84:40:c5:50 (20:cd:84:40:c5:50), Dst: e6:c5:01:75:da:82 (e6:c5:01:75:da:82)
Internet Protocol Version 6, Src: 2409:40c2:2041:2b27:3810:1fb5:6364:a871, Dst: 2404:6800:4009:80f::200e
User Datagram Protocol, Src Port: 56960, Dst Port: 443
QUIC IETF

No.     Time                          Source                Destination           Protocol Length Info
     50 2025-09-22 13:45:20.744948    2409:40c2:2041:2b27:3810:1fb5:6364:a871 2404:6800:4009:80f::200e QUIC     1288   0-RTT, DCID=f16279e079c1d051

Frame 50: 1288 bytes on wire (10304 bits), 1288 bytes captured (10304 bits) on interface \Device\NPF_{F12C3727-7243-43E8-A737-66239F07376D}, id 0
Ethernet II, Src: 20:cd:84:40:c5:50 (20:cd:84:40:c5:50), Dst: e6:c5:01:75:da:82 (e6:c5:01:75:da:82)
Internet Protocol Version 6, Src: 2409:40c2:2041:2b27:3810:1fb5:6364:a871, Dst: 2404:6800:4009:80f::200e
User Datagram Protocol, Src Port: 56960, Dst Port: 443
QUIC IETF

No.     Time                          Source                Destination           Protocol Length Info
     51 2025-09-22 13:45:20.745087    2409:40c2:2041:2b27:3810:1fb5:6364:a871 2404:6800:4009:80f::200e QUIC     1292   0-RTT, DCID=f16279e079c1d051

Frame 51: 1292 bytes on wire (10336 bits), 1292 bytes captured (10336 bits) on interface \Device\NPF_{F12C3727-7243-43E8-A737-66239F07376D}, id 0
Ethernet II, Src: 20:cd:84:40:c5:50 (20:cd:84:40:c5:50), Dst: e6:c5:01:75:da:82 (e6:c5:01:75:da:82)
Internet Protocol Version 6, Src: 2409:40c2:2041:2b27:3810:1fb5:6364:a871, Dst: 2404:6800:4009:80f::200e
User Datagram Protocol, Src Port: 56960, Dst Port: 443
QUIC IETF

No.     Time                          Source                Destination           Protocol Length Info
     52 2025-09-22 13:45:20.745141    2409:40c2:2041:2b27:3810:1fb5:6364:a871 2404:6800:4009:80f::200e QUIC     719    0-RTT, DCID=f16279e079c1d051

Frame 52: 719 bytes on wire (5752 bits), 719 bytes captured (5752 bits) on interface \Device\NPF_{F12C3727-7243-43E8-A737-66239F07376D}, id 0
Ethernet II, Src: 20:cd:84:40:c5:50 (20:cd:84:40:c5:50), Dst: e6:c5:01:75:da:82 (e6:c5:01:75:da:82)
Internet Protocol Version 6, Src: 2409:40c2:2041:2b27:3810:1fb5:6364:a871, Dst: 2404:6800:4009:80f::200e
User Datagram Protocol, Src Port: 56960, Dst Port: 443
QUIC IETF

No.     Time                          Source                Destination           Protocol Length Info
     53 2025-09-22 13:45:20.745174    2409:40c2:2041:2b27:3810:1fb5:6364:a871 2404:6800:4009:80f::200e QUIC     142    0-RTT, DCID=f16279e079c1d051

Frame 53: 142 bytes on wire (1136 bits), 142 bytes captured (1136 bits) on interface \Device\NPF_{F12C3727-7243-43E8-A737-66239F07376D}, id 0
Ethernet II, Src: 20:cd:84:40:c5:50 (20:cd:84:40:c5:50), Dst: e6:c5:01:75:da:82 (e6:c5:01:75:da:82)
Internet Protocol Version 6, Src: 2409:40c2:2041:2b27:3810:1fb5:6364:a871, Dst: 2404:6800:4009:80f::200e
User Datagram Protocol, Src Port: 56960, Dst Port: 443
QUIC IETF

No.     Time                          Source                Destination           Protocol Length Info
     54 2025-09-22 13:45:20.789836    e6:c5:01:75:da:82     Broadcast             ARP      42     Who has 10.164.75.190? Tell 10.164.75.150

Frame 54: 42 bytes on wire (336 bits), 42 bytes captured (336 bits) on interface \Device\NPF_{F12C3727-7243-43E8-A737-66239F07376D}, id 0
Ethernet II, Src: e6:c5:01:75:da:82 (e6:c5:01:75:da:82), Dst: Broadcast (ff:ff:ff:ff:ff:ff)
Address Resolution Protocol (request)

No.     Time                          Source                Destination           Protocol Length Info
     55 2025-09-22 13:45:20.827893    2404:6800:4009:80f::200e 2409:40c2:2041:2b27:3810:1fb5:6364:a871 QUIC     102    Initial, SCID=f16279e079c1d051, PKN: 1, ACK

Frame 55: 102 bytes on wire (816 bits), 102 bytes captured (816 bits) on interface \Device\NPF_{F12C3727-7243-43E8-A737-66239F07376D}, id 0
Ethernet II, Src: e6:c5:01:75:da:82 (e6:c5:01:75:da:82), Dst: 20:cd:84:40:c5:50 (20:cd:84:40:c5:50)
Internet Protocol Version 6, Src: 2404:6800:4009:80f::200e, Dst: 2409:40c2:2041:2b27:3810:1fb5:6364:a871
User Datagram Protocol, Src Port: 443, Dst Port: 56960
QUIC IETF

No.     Time                          Source                Destination           Protocol Length Info
     56 2025-09-22 13:45:20.827893    2404:6800:4009:80f::200e 2409:40c2:2041:2b27:3810:1fb5:6364:a871 QUIC     102    Initial, SCID=f16279e079c1d051, PKN: 2, ACK

Frame 56: 102 bytes on wire (816 bits), 102 bytes captured (816 bits) on interface \Device\NPF_{F12C3727-7243-43E8-A737-66239F07376D}, id 0
Ethernet II, Src: e6:c5:01:75:da:82 (e6:c5:01:75:da:82), Dst: 20:cd:84:40:c5:50 (20:cd:84:40:c5:50)
Internet Protocol Version 6, Src: 2404:6800:4009:80f::200e, Dst: 2409:40c2:2041:2b27:3810:1fb5:6364:a871
User Datagram Protocol, Src Port: 443, Dst Port: 56960
QUIC IETF

No.     Time                          Source                Destination           Protocol Length Info
     57 2025-09-22 13:45:20.831421    2404:6800:4009:80f::200e 2409:40c2:2041:2b27:3810:1fb5:6364:a871 QUIC     1292   Initial, SCID=f16279e079c1d051, PKN: 3, ACK, PADDING

Frame 57: 1292 bytes on wire (10336 bits), 1292 bytes captured (10336 bits) on interface \Device\NPF_{F12C3727-7243-43E8-A737-66239F07376D}, id 0
Ethernet II, Src: e6:c5:01:75:da:82 (e6:c5:01:75:da:82), Dst: 20:cd:84:40:c5:50 (20:cd:84:40:c5:50)
Internet Protocol Version 6, Src: 2404:6800:4009:80f::200e, Dst: 2409:40c2:2041:2b27:3810:1fb5:6364:a871
User Datagram Protocol, Src Port: 443, Dst Port: 56960
QUIC IETF

No.     Time                          Source                Destination           Protocol Length Info
     58 2025-09-22 13:45:20.831421    2404:6800:4009:80f::200e 2409:40c2:2041:2b27:3810:1fb5:6364:a871 QUIC     1292   Initial, SCID=f16279e079c1d051, PKN: 4, ACK, PADDING

Frame 58: 1292 bytes on wire (10336 bits), 1292 bytes captured (10336 bits) on interface \Device\NPF_{F12C3727-7243-43E8-A737-66239F07376D}, id 0
Ethernet II, Src: e6:c5:01:75:da:82 (e6:c5:01:75:da:82), Dst: 20:cd:84:40:c5:50 (20:cd:84:40:c5:50)
Internet Protocol Version 6, Src: 2404:6800:4009:80f::200e, Dst: 2409:40c2:2041:2b27:3810:1fb5:6364:a871
User Datagram Protocol, Src Port: 443, Dst Port: 56960
QUIC IETF

